{
  "id": "8389f7db-3260-4d2e-b0b2-dc15dbe93045",
  "created_at": "2025-08-25T03:23:26.849373",
  "updated_at": "2025-08-25T03:27:35.032062",
  "project_path": "D:\\Projects\\Dev\\Memory",
  "git_info": {
    "branch": "develop",
    "hash": "040a46e1",
    "dirty": true
  },
  "context_data": {
    "last_tool_used": "Bash",
    "last_tool_time": "2025-08-25T03:27:35.031061",
    "tool_count": 1
  },
  "status": "active",
  "tool_usage": [
    {
      "tool_name": "Bash",
      "timestamp": "2025-08-25T03:23:37.317661",
      "input_data": {
        "command": "python .prsist/hooks/SessionStart.py",
        "description": "Test updated SessionStart hook"
      },
      "output_data": "{'stdout': '{\\r\\n  \"status\": \"success\",\\r\\n  \"session_id\": \"8389f7db-3260-4d2e-b0b2-dc15dbe93045\",\\r\\n  \"message\": \"Memory system activated - Session 8389f7db\",\\r\\n  \"context\": \"# Project Context\\\\n**Project Root:** D:\\\\\\\\Projects\\\\\\\\Dev\\\\\\\\Memory\\\\n**Timestamp:** 2025-08-25T03:23:36.115231\\\\n**Git Branch:** develop\\\\n**Git Hash:** 040a46e1\\\\n**Git Status:** Working directory has uncommitted changes\\\\n\\\\n## Project Memory\\\\n\\\\n# Project Memory\\\\n\\\\nThis file contains persistent project context and learned information that should be preserved across Claude Code sessions.\\\\n\\\\n## Project Overview\\\\n\\\\n**Project Path:** D:\\\\\\\\Projects\\\\\\\\Dev\\\\\\\\Memory\\\\n**Memory System:** Prsist Memory System v1.0\\\\n**Created:** 2025-01-17\\\\n\\\\nThis project implements the Prsist System framework with an integrated Prsist Memory System for enhanced AI-powered development workflows.\\\\n\\\\n## Key Decisions and Patterns\\\\n\\\\n### Architecture Decisions\\\\n\\\\n- **Hybrid Storage Strategy**: Combination of JSON files for session data and SQLite database for efficient querying and relationships\\\\n- **Hook-Based Integration**: Non-invasive integration with Claude Code using hooks that fail gracefully\\\\n- **Modular Design**: Separate modules for database, session tracking, context building, and memory management\\\\n- **Security-First Approach**: Input sanitization, path validation, and parameterized queries throughout\\\\n\\\\n### Development Patterns\\\\n\\\\n- **Dependency Resolution System**: BMAD agents only load required resources to keep context lean\\\\n- **Template-Based Documentation**: YAML-structured templates for consistent document generation\\\\n- **Automated Release Strategy**: Dual publishing with beta and stable channels\\\\n\\\\n## Important Context\\\\n\\\\n### Prsist System Framework\\\\n- Uses specialized AI agents for different development roles (architect, developer, QA, etc.)\\\\n- Implements sophisticated dependency system for context management\\\\n- Templates defined in YAML format with structured sections\\\\n- Build system creates concatenated text bundles from agent definitions\\\\n\\\\n### Memory System Integration\\\\n- Phase 1 focuses on core session tracking with hooks, session files, SQLite storage, and basic context injection\\\\n- Designed to be compatible with existing BMAD workflows\\\\n- Must not interfere with Claude Code performance (hooks complete within 2 seconds)\\\\n- Implements automatic cleanup and retention policies\\\\n\\\\n### Configuration Management\\\\n- Central configuration in `bmad-core/core-config.yaml`\\\\n- Memory system configuration in `.prsist/config/memory-config.yaml`\\\\n- Markdown linting rules enforced via Prettier\\\\n- Version management for core and expansion packs\\\\n\\\\n## Development Notes\\\\n\\\\n### Performance Requirements\\\\n- Hook execution must complete within 2 seconds\\\\n- Memory usage should be minimal (< 50MB)\\\\n- Database operations should be atomic\\\\n- File I/O should be non-blocking where possible\\\\n\\\\n### Security Considerations\\\\n- All file paths validated to prevent directory traversal\\\\n- Inputs sanitized before database insertion\\\\n- Parameterized SQL queries used throughout\\\\n- Appropriate file permissions set on memory system files\\\\n\\\\n### Testing Strategy\\\\n- Session creation and tracking validation\\\\n- SQLite database operations verification\\\\n- Context injection functionality testing\\\\n- Hook execution timing validation\\\\n- Error handling and edge case testing\\\\n\\\\n## Architecture Notes\\\\n\\\\n### Memory System Components\\\\n\\\\n1. **Database Layer** (`database.py`): SQLite operations for persistent storage\\\\n2. **Session Tracker** (`session_tracker.py`): Session lifecycle management\\\\n3. **Context Builder** (`context_builder.py`): Context injection and relevance scoring\\\\n4. **Memory Manager** (`memory_manager.py`): Main interface for memory operations\\\\n5. **Utilities** (`utils.py`): Common helpers and validation functions\\\\n\\\\n### Integration Points\\\\n\\\\n- **Claude Code Hooks**: `SessionStart.py` and `PostToolUse.py` in `.claude/hooks/`\\\\n- **Configuration Files**: YAML configuration and JSON schema validation\\\\n- **Storage Structure**: Organized directory structure under `.prsist/`\\\\n- **BMAD Compatibility**: Designed to work seamlessly with existing BMAD workflows\\\\n\\\\n### Data Flow\\\\n\\\\n1. Session starts \\\\u2192 Hook initializes memory system \\\\u2192 Context loaded for Claude\\\\n2. Tool usage \\\\u2192 Hook logs interaction \\\\u2192 Database updated \\\\u2192 Session file updated\\\\n3. File modifications \\\\u2192 Tracked and hashed \\\\u2192 Line changes calculated\\\\n4. Periodic checkpoints \\\\u2192 Session state preserved \\\\u2192 Cleanup based on retention policy\\\\n\\\\n## Future Enhancements (Phase 2+)\\\\n\\\\n- Semantic similarity scoring for context relevance\\\\n- Advanced context scoring algorithms\\\\n- Intelligent summarization of session data\\\\n- Cross-session learning and pattern recognition\\\\n- Integration with BMAD agent memory sharing\\\\n- Enhanced workflow integration capabilities\\\\n\\\\n## Updated 2025-08-17 15:01:07\\\\n\\\\n\\\\u2705 **Memory System Integration** completed at 2025-08-17 15:01\\\\n   Successfully integrated Claude Code hooks with memory system for session tracking and context injection\\\\n\\\\n## Updated 2025-08-18 17:45:17\\\\n\\\\n\\\\u2705 **Documentation Organized** completed at 2025-08-18 17:45\\\\n   Created clean docs folder with accurate documentation, removed fictional content, updated README with current implementation status\\\\n\\\\n## Updated 2025-08-18 18:31:13\\\\n\\\\n\\\\u2705 **Simple CLI Commands** completed at 2025-08-18 18:31\\\\n   Created prsist.py with single-letter commands that can be chained together, making the memory system much easier to use\\\\n\\\\n## Updated 2025-08-18 18:33:07\\\\n\\\\n\\\\u2705 **Complete CLI Interface** completed at 2025-08-18 18:33\\\\n   Added all missing commands to prsist.py including session management, data operations, project memory, decisions, export, cleanup - every possible memory operation now has a simple single-letter command that can be chained together\\\\n\\\\n## Updated 2025-08-18 18:42:37\\\\n\\\\n\\\\u2705 **CLI Testing Complete** completed at 2025-08-18 18:42\\\\n   Created comprehensive test suite that validates all 28 CLI commands and command combinations with 100% success rate - every single memory operation is working perfectly\\\\n\\\\n## Updated 2025-08-19 12:46:18\\\\n\\\\n\\\\u2705 **Phase 1 Complete** completed at 2025-08-19 12:46\\\\n   Fixed Claude Code hooks, validated performance, completed all requirements\\\\n\\\\n## Updated 2025-08-19 12:46:50\\\\n\\\\n**Decision Made**: Fixed Claude Code hooks integration for automatic memory activation\\\\n\\\\n## Updated 2025-08-19 12:49:34\\\\n\\\\n\\\\u2705 **Memory CLI Fixed** completed at 2025-08-19 12:49\\\\n   Created proper CLI interface that handles arguments correctly\\\\n\\\\n## Updated 2025-08-19 12:49:49\\\\n\\\\n**Decision**: Use argument-based CLI instead of interactive prompts for better Claude Code integration\\\\n\\\\n## Updated 2025-08-19 12:50:12\\\\n\\\\n**Decision**: Use argument-based CLI instead of interactive prompts for better Claude Code integration\\\\n\\\\n## Updated 2025-08-19 12:58:59\\\\n\\\\n\\\\u2705 **Documentation Created** completed at 2025-08-19 12:58\\\\n   Added quick reference guide and command system\\\\n\\\\n## Updated 2025-08-19 12:59:33\\\\n\\\\n\\\\u2705 **Documentation Created** completed at 2025-08-19 12:59\\\\n   Added quick reference guide and command system\\\\n\\\\n## Updated 2025-08-19 12:59:47\\\\n\\\\n**Decision**: Create user-friendly command interface for better Claude Code integration\\\\n\\\\n## Updated 2025-08-19 13:23:52\\\\n\\\\n\\\\u2705 **Slash Commands Complete** completed at 2025-08-19 13:23\\\\n   Created 17 native Claude Code slash commands covering all memory system functionality\\\\n\\\\n## Updated 2025-08-25 02:28:24\\\\n\\\\nIntegration testing completed successfully with all major components operational\\\\n\\\\n## Recent Decisions\\\\n\\\\n- **Modular Python Architecture** (2025-01-17T00:00:00Z): Separated memory system into distinct modules: database, session_tracker, context_builder, memory_manager, and utils. Each module has a single responsibility.\\\\n- **Security-First Implementation** (2025-01-17T00:00:00Z): Implemented comprehensive security measures including path validation, input sanitization, and parameterized SQL queries throughout the system.\\\\n- **Performance Constraints** (2025-01-17T00:00:00Z): Set strict performance requirements: hooks must complete within 2 seconds, memory usage under 50MB, atomic database operations.\\\\n- **YAML Configuration Management** (2025-01-17T00:00:00Z): Used YAML for configuration files to maintain consistency with Prsist System framework and improve human readability.\\\\n- **Graceful Degradation Design** (2025-01-17T00:00:00Z): Designed all components to fail gracefully when memory system is unavailable or encounters errors, ensuring Claude Code continues to function normally.\\\\n\\\\n